{
  "schema_version": "1.0.0",
  "suite_version": "1.0.0",
  "backend": "qwen",
  "qwen": {
    "model_asset": "qwen_model",
    "tokenizer_asset": "qwen_tokenizer",
    "run_mode": "heal",
    "streaming": false,
    "decode": false,
    "packing": false,
    "padding": "none",
    "attention_mask": "all_ones"
  },
  "baseline": "gdn2_native",
  "mechanism": "exact_cache",
  "variant": "top_surprise",
  "task": {
    "name": "ruler",
    "params": {
      "objective": "language_model_heal",
      "ce_weight": 0.1,
      "kl_weight": 1.0,
      "layerwise_weight": 0.1,
      "temperature": 2.0,
      "accumulation_steps": 1,
      "native_r_out": 4,
      "score_scan": "gdn3.kmd2_fast_scan.scan_with_update_norm",
      "gradient_checkpointing": true,
      "convolution": "on",
      "example_ids": [
        "heal-window-0000",
        "heal-window-0001",
        "heal-window-0002",
        "heal-window-0003",
        "heal-window-0004",
        "heal-window-0005",
        "heal-window-0006",
        "heal-window-0007",
        "heal-window-0008",
        "heal-window-0009",
        "heal-window-0010",
        "heal-window-0011",
        "heal-window-0012",
        "heal-window-0013",
        "heal-window-0014",
        "heal-window-0015",
        "heal-window-0016",
        "heal-window-0017",
        "heal-window-0018",
        "heal-window-0019",
        "heal-window-0020",
        "heal-window-0021",
        "heal-window-0022",
        "heal-window-0023",
        "heal-window-0024",
        "heal-window-0025",
        "heal-window-0026",
        "heal-window-0027",
        "heal-window-0028",
        "heal-window-0029",
        "heal-window-0030",
        "heal-window-0031",
        "heal-window-0032",
        "heal-window-0033",
        "heal-window-0034",
        "heal-window-0035",
        "heal-window-0036",
        "heal-window-0037",
        "heal-window-0038",
        "heal-window-0039",
        "heal-window-0040",
        "heal-window-0041",
        "heal-window-0042",
        "heal-window-0043",
        "heal-window-0044",
        "heal-window-0045",
        "heal-window-0046",
        "heal-window-0047",
        "heal-window-0048",
        "heal-window-0049",
        "heal-window-0050",
        "heal-window-0051",
        "heal-window-0052",
        "heal-window-0053",
        "heal-window-0054",
        "heal-window-0055",
        "heal-window-0056",
        "heal-window-0057",
        "heal-window-0058",
        "heal-window-0059",
        "heal-window-0060",
        "heal-window-0061",
        "heal-window-0062",
        "heal-window-0063",
        "heal-window-0064",
        "heal-window-0065",
        "heal-window-0066",
        "heal-window-0067",
        "heal-window-0068",
        "heal-window-0069",
        "heal-window-0070",
        "heal-window-0071",
        "heal-window-0072",
        "heal-window-0073",
        "heal-window-0074",
        "heal-window-0075",
        "heal-window-0076",
        "heal-window-0077",
        "heal-window-0078",
        "heal-window-0079",
        "heal-window-0080",
        "heal-window-0081",
        "heal-window-0082",
        "heal-window-0083",
        "heal-window-0084",
        "heal-window-0085",
        "heal-window-0086",
        "heal-window-0087",
        "heal-window-0088",
        "heal-window-0089",
        "heal-window-0090",
        "heal-window-0091",
        "heal-window-0092",
        "heal-window-0093",
        "heal-window-0094",
        "heal-window-0095",
        "heal-window-0096",
        "heal-window-0097",
        "heal-window-0098",
        "heal-window-0099",
        "heal-window-0100",
        "heal-window-0101",
        "heal-window-0102",
        "heal-window-0103",
        "heal-window-0104",
        "heal-window-0105",
        "heal-window-0106",
        "heal-window-0107",
        "heal-window-0108",
        "heal-window-0109",
        "heal-window-0110",
        "heal-window-0111",
        "heal-window-0112",
        "heal-window-0113",
        "heal-window-0114",
        "heal-window-0115",
        "heal-window-0116",
        "heal-window-0117",
        "heal-window-0118",
        "heal-window-0119",
        "heal-window-0120",
        "heal-window-0121",
        "heal-window-0122",
        "heal-window-0123",
        "heal-window-0124",
        "heal-window-0125",
        "heal-window-0126",
        "heal-window-0127",
        "heal-window-0128",
        "heal-window-0129",
        "heal-window-0130",
        "heal-window-0131",
        "heal-window-0132",
        "heal-window-0133",
        "heal-window-0134",
        "heal-window-0135",
        "heal-window-0136",
        "heal-window-0137",
        "heal-window-0138",
        "heal-window-0139",
        "heal-window-0140",
        "heal-window-0141",
        "heal-window-0142",
        "heal-window-0143",
        "heal-window-0144",
        "heal-window-0145",
        "heal-window-0146",
        "heal-window-0147",
        "heal-window-0148",
        "heal-window-0149",
        "heal-window-0150",
        "heal-window-0151",
        "heal-window-0152",
        "heal-window-0153",
        "heal-window-0154",
        "heal-window-0155",
        "heal-window-0156",
        "heal-window-0157",
        "heal-window-0158",
        "heal-window-0159",
        "heal-window-0160",
        "heal-window-0161",
        "heal-window-0162",
        "heal-window-0163",
        "heal-window-0164",
        "heal-window-0165",
        "heal-window-0166",
        "heal-window-0167",
        "heal-window-0168",
        "heal-window-0169",
        "heal-window-0170",
        "heal-window-0171",
        "heal-window-0172",
        "heal-window-0173",
        "heal-window-0174",
        "heal-window-0175",
        "heal-window-0176",
        "heal-window-0177",
        "heal-window-0178",
        "heal-window-0179",
        "heal-window-0180",
        "heal-window-0181",
        "heal-window-0182",
        "heal-window-0183",
        "heal-window-0184",
        "heal-window-0185",
        "heal-window-0186",
        "heal-window-0187",
        "heal-window-0188",
        "heal-window-0189",
        "heal-window-0190",
        "heal-window-0191",
        "heal-window-0192",
        "heal-window-0193",
        "heal-window-0194",
        "heal-window-0195",
        "heal-window-0196",
        "heal-window-0197",
        "heal-window-0198",
        "heal-window-0199",
        "heal-window-0200",
        "heal-window-0201",
        "heal-window-0202",
        "heal-window-0203",
        "heal-window-0204",
        "heal-window-0205",
        "heal-window-0206",
        "heal-window-0207",
        "heal-window-0208",
        "heal-window-0209",
        "heal-window-0210",
        "heal-window-0211",
        "heal-window-0212",
        "heal-window-0213",
        "heal-window-0214",
        "heal-window-0215",
        "heal-window-0216",
        "heal-window-0217",
        "heal-window-0218",
        "heal-window-0219",
        "heal-window-0220",
        "heal-window-0221",
        "heal-window-0222",
        "heal-window-0223",
        "heal-window-0224",
        "heal-window-0225",
        "heal-window-0226",
        "heal-window-0227",
        "heal-window-0228",
        "heal-window-0229",
        "heal-window-0230",
        "heal-window-0231",
        "heal-window-0232",
        "heal-window-0233",
        "heal-window-0234",
        "heal-window-0235",
        "heal-window-0236",
        "heal-window-0237",
        "heal-window-0238",
        "heal-window-0239",
        "heal-window-0240",
        "heal-window-0241",
        "heal-window-0242",
        "heal-window-0243",
        "heal-window-0244",
        "heal-window-0245",
        "heal-window-0246",
        "heal-window-0247",
        "heal-window-0248",
        "heal-window-0249",
        "heal-window-0250",
        "heal-window-0251",
        "heal-window-0252",
        "heal-window-0253",
        "heal-window-0254",
        "heal-window-0255",
        "heal-window-0256",
        "heal-window-0257",
        "heal-window-0258",
        "heal-window-0259",
        "heal-window-0260",
        "heal-window-0261",
        "heal-window-0262",
        "heal-window-0263",
        "heal-window-0264",
        "heal-window-0265",
        "heal-window-0266",
        "heal-window-0267",
        "heal-window-0268",
        "heal-window-0269",
        "heal-window-0270",
        "heal-window-0271",
        "heal-window-0272",
        "heal-window-0273",
        "heal-window-0274",
        "heal-window-0275",
        "heal-window-0276",
        "heal-window-0277",
        "heal-window-0278",
        "heal-window-0279",
        "heal-window-0280",
        "heal-window-0281",
        "heal-window-0282",
        "heal-window-0283",
        "heal-window-0284",
        "heal-window-0285",
        "heal-window-0286",
        "heal-window-0287",
        "heal-window-0288",
        "heal-window-0289",
        "heal-window-0290",
        "heal-window-0291",
        "heal-window-0292",
        "heal-window-0293",
        "heal-window-0294",
        "heal-window-0295",
        "heal-window-0296",
        "heal-window-0297",
        "heal-window-0298",
        "heal-window-0299",
        "heal-window-0300",
        "heal-window-0301",
        "heal-window-0302",
        "heal-window-0303",
        "heal-window-0304",
        "heal-window-0305",
        "heal-window-0306",
        "heal-window-0307",
        "heal-window-0308",
        "heal-window-0309",
        "heal-window-0310",
        "heal-window-0311",
        "heal-window-0312",
        "heal-window-0313",
        "heal-window-0314",